id,name,type,definition,unit,cognitive_level,example,misconception
N001,平均变化率,基础概念,"Δy/Δx表示函数值变化量与自变量变化量的比值",九年级下第三章,记忆层,"汽车2小时内行驶120km，平均速度60km/h","误认为只适用于线性变化"
N002,瞬时变化率,核心概念,"当Δx趋近于0时的极限值",九年级下第三章,理解层,"赛车在3秒时的瞬时速度","混淆平均变化率与瞬时变化率"
N003,导数定义,核心概念,"f'(x)=lim_{Δx→0} [f(x+Δx)-f(x)]/Δx",九年级下第三章,应用层,"求f(x)=x²在x=2处的导数","忽略极限存在条件"
N004,导函数,拓展概念,"由各点导数构成的函数",九年级下第三章,分析层,"f(x)=x³的导函数f'(x)=3x²","混淆导数值与导函数"
N005,切线斜率,几何意义,"曲线在某点处切线的斜率值",九年级下第三章,应用层,"求抛物线顶点处的切线方程","误用直线斜率公式"
N006,瞬时速度,物理应用,"位移函数的导数值",九年级下第三章,综合应用,"自由落体运动3秒时的速度","与平均速度概念混淆" 